{
  "$schema": "https://json-schema.org/draft/2020-12/schema",
  "title": "Chore",
  "description": "One routine the app can run: a list of steps, each found on screen before it is done.",
  "type": "object",
  "required": ["name", "goal", "doneWhen", "startsAt", "steps"],
  "additionalProperties": false,
  "properties": {
    "name": { "type": "string", "description": "Short name the player sees, e.g. 'Daily check-in'." },
    "goal": { "type": "string", "description": "What it is for, in the player's words." },
    "doneWhen": { "type": "string", "description": "How you know it worked, as something visible on screen." },
    "startsAt": { "type": "string", "description": "The screen this begins on, named as in knowledge/screens.md." },
    "endsAt": { "type": "string", "description": "The screen it leaves you on. Chores chain, so this should usually match the next one's startsAt." },
    "needs": { "type": "array", "items": { "type": "string" }, "description": "Anything required first: a key, coins, a level." },
    "steps": {
      "type": "array",
      "minItems": 1,
      "items": {
        "type": "object",
        "required": ["find", "do", "expect"],
        "additionalProperties": false,
        "properties": {
          "find": { "type": "string", "description": "What to look for on screen, in words a person could follow." },
          "do": { "type": "string", "enum": ["tap", "hold", "swipe"], "description": "What to do to it." },
          "expect": { "type": "string", "description": "What should happen, so the app can tell it worked." },
          "near": {
            "type": "object",
            "description": "Roughly where it sat when recorded, as fractions of the screen. A hint for where to look first, never the only way to find it.",
            "required": ["x", "y"],
            "additionalProperties": false,
            "properties": {
              "x": { "type": "number", "minimum": 0, "maximum": 1 },
              "y": { "type": "number", "minimum": 0, "maximum": 1 },
              "x2": { "type": "number", "minimum": 0, "maximum": 1, "description": "Swipe end." },
              "y2": { "type": "number", "minimum": 0, "maximum": 1, "description": "Swipe end." }
            }
          },
          "holdMs": { "type": "integer", "minimum": 1, "maximum": 5000, "description": "How long to hold, for a hold or swipe." },
          "confirmFirst": { "type": "boolean", "default": false, "description": "Ask the player before doing it: buying, selling, anything that cannot be undone." },
          "repeat": { "type": "boolean", "default": false, "description": "Part of a block that runs again while its first step is still on screen, e.g. buying every item." },
          "optional": { "type": "boolean", "default": false, "description": "Carry on rather than stop if it is not found, e.g. a popup that only shows sometimes." }
        }
      }
    },
    "source": { "type": "string", "description": "The log entry this came from." },
    "signed": { "type": "string", "description": "Who wrote it and when, e.g. 'Claude, 2026-10-25'." }
  }
}
